Input sentence,Output sentence,
"पीने योग्य पानी का  त्रोत, नदी, तालाब एंव भीतरी स्तह में सस्थित पानी है।","पीने योग्य पानी का  स्त्रोत नदी, तालाब एवं  भीतरी सतह में स्थित पानी है।",
इन्सान द्वारा जल्दी-जल्दी अपने आप को बनाने के कारण सब ने बहुत ज्यादा पानी उपयोग किया है।,इन्सान द्वारा जल्दी-जल्दी अपने आप को बनाने के कारण सब ने बहुत ज्यादा पानी उपयोग किया है।,
इस कारण सभी त्रोत में पानी कि कमी हुई  हैं ।,इस कारण सभी स्त्रोत में पानी की कमी हुई है।,
इस कमी के कारण पानी कई तरह से प्रदू‌षित होते हैं ,इस कमी के कारण पानी कई तरह से प्रदू‌षित होता हैं ।,
"जैसे कि, जब नदी तालाब में पानी कम रहती अकसर ये देखा जाता कि,  पानी से जुई मिटटी को रासायन पदार्थ छोड़ने  लगते और वो रासायन पदार्थ पानी को प्रदूषित करते।",जैसे कि जब नदी तालाब में पानी कम रहता है तो अकसर ये देखा जाता कि  पानी से जुड़ी  मिटटी को रसायन पदार्थ छोड़ने  लगते हैं और वो रसायन पदार्थ पानी को प्रदूषित करते हैं। ,
"उदाहरण के लिए, फ्लोराइड, आर्सनिक, उरेनियमा,नाइटरेट, जैसे रासायन पानी को पीने योग्य नहीं छोड़ते। इसके कारण ये पानी किसी भी उपयोग के लिए नहीं रहता।","उदाहरण के लिए, फ्लोराइड, आर्सेनिक, यूरेनियम, नाइटरेट जैसे रासायन पानी को पीने योग्य नहीं छोड़ते, जिसके कारण ये पानी किसी भी उपयोग के लिए नहीं रहता।",
"यो प्रदूषण, प्राकृतिक प्रदूषण हैं।",ये प्रदूषण प्राकृतिक प्रदूषण हैं ।,
इंसान के छोड़-छाड़ के कारण भी पानी बहुत प्रदूषित हैं।,इंसान की छेड़-छाड़ के कारण भी पानी बहुत प्रदूषित होता है।,
"सबसे बड़ा कारण है, मल-जल (waste water) यह जल लोगों के घर से, संस्था से, अस्पताल से निकलता है।","सबसे बड़ा कारण है मल-जल (waste water) यह जल लोगों के घर से, संस्था से, अस्पताल से निकलता है।",
"नियम अनुसार ये जल एक स्थान पे साफ होना चाहिए, फिर इसे, नदी या तलाब या जमीन पे छोड़ना चाहिए ।",नियम अनुसार यह जल एक स्थान पर साफ होना चाहिए फिर इसे नदी या तलाब या जमीन पर छोड़ना चाहिए ।,
बहुत ज्यादा मल-जल के कारण ये देखा गया है कि यह पानी ऐसे हि नदी में छोड़ दिया जाता ।,बहुत ज्यादा मल-जल के कारण ये देखा गया है कि यह पानी ऐसे ही नदी में छोड़ दिया जाता ।,
"उदाहरण के लिए गंगा नदी, ",उदाहरण के लिए गंगा नदी।,
"एक समय था,जब गंगा का पानी शुद्ध, सभी उपयोग के लिए उचित था। लेकिन वर्तमान, कई गतिविधिया के कारण, यह पानी बिल्कुल भी उपयोगी नहीं हैं।","एक समय था जब गंगा का पानी शुद्ध एवं सभी उपयोग के लिए उचित था, लेकिन वर्तमान में कई गतिविधियोंं के कारण यह पानी बिल्कुल भी उपयोगी नहीं है।",
"यह कहानी सिर्फ भारत कि नहीं, बल्की कई दुसरे देशो कि भी हैं।",यह कहानी सिर्फ भारत की ही नहीं बल्कि कई दूसरे देशों की  भी है।,
"उधोयोगिक स्थानो से भी बहुत सारा प्रदूषित पानी आता, जो कई नदी, तलाब को प्रदूषित करता।",औद्योगिक स्थानो से भी बहुत सारा प्रदूषित पानी आता है जो कई नदी तलाब को प्रदूषित करता है।,
"जब कोई नदी, तलाब इन जल के कारण प्रदुषित होता, उस पूरे जल के पर्यावरण को भी खराब करता हैं ।",जब कोई नदी तालाब दूषित जल के कारण प्रदूषित होता तो उस पूरे जल के पर्यावरण को भी खराब करता है ।,
"उस नदी व तलाब में रह रहे, जानवर, पेड़ सभी उस प्रदूषित पानी का शिकार होते और उनकी मृत्यु होने कि संभावना रहती।","उस नदी व तालाब में रह रहे जानवर, पेड़ सभी उस प्रदूषित पानी का शिकार होते और उनकी मृत्यु होने की संभावना रहती।",
"इन सब को ठीक करने के लिए, सरकार बहुत सारी कानुन लागु कि हैं। लेकिन वो सिर्फ किताबे में हि सिमित रहती।","इन सब को ठीक करने के लिए सरकार ने बहुत सारे कानून लागू किये हैं, लेकिन वो सिर्फ किताबों में ही सीमित रहते।",
कोई लोग उसे अच्छी तरह से पालन नहीं करते।,कोई भी उसका अच्छी तरह से पालन नहीं करता।,
"इस कारण एक बार प्रदू‌षित पानी, प्रदू‌षित हि रह जाती।",इस कारण एक बार प्रदू‌षित पानी प्रदू‌षित ही रह जाता।,
"इसके अलावा ये भी देखा गया है कि आम लोग, इसे लेकर उतना जागरूक नहीं हैं।","इसके अलावा ये भी देखा गया है कि आम लोग, इसे लेकर उतना जागरूक नहीं हैं।",
एक अच्छी शिक्षा कि अवस्यकता है।,एक अच्छी शिक्षा की आवश्यकता है।,
जो लोगो को समझा सके कि क्या करना उचित होग ।,जो लोगो को समझा सके कि क्या करना उचित होगा?,
इसी आबादी ने पानी के साथ वायु को भी प्रदूषित किया हैं।,इसी आबादी ने पानी के साथ वायु को भी प्रदूषित किया है।,
"इसके मुख्य कारण हैं। लकड़ी जलाना, गाड़ी का बहुत मात्रा में उपयोग करना रेफरिजरेटर। वाताकुलिनित समान का उपयोग करना ।","इसके मुख्य कारण हैं लकड़ी जलाना, गाड़ी का बहुत मात्रा में उपयोग करना, रेफरिजरेटर, वाताकुलिनित समान का उपयोग करना ।",
"इन सब के कारण देखा गया है कि वायु में अनाआवस्यक जिसे जैसे, ज्यादा मात्रा में कार्बन डाई अक्साइड (CO₂), एंव अन्य चिज आ जाती।","इन सब के कारण देखा गया है कि वायु में अनावश्यक ज्यादा मात्रा में कार्बन डाई अक्साइड (CO₂), एवं अन्य वस्तुयें आ जाती हैं।",
"बहुत बार देखा गया है कि वहाँ के लोग खाना बनाने के लिए लकड़ी जलाते, इसके कारण बहुत हि खराब वायु निकलति।",बहुत बार देखा गया है कि वहाँ के लोग खाना बनाने के लिए लकड़ी जलाते जिसके कारण बहुत ही खराब वायु निकलती।,
"ऐसे हि, बहुत ज्यादा गाड़ी चलने के कारण, हमारी वायु में बहुत सारे ऐसे चीज आती जो हवा को सांस लेने के लिए उचित नहीं छोड़ते ।",ऐसे ही  बहुत ज्यादा गाड़ी चलने के कारण हमारी वायु में बहुत सारी ऐसी चीज आती जो हवा में  सांस लेने के लिए उचित नहीं होती।,
"खतरनाक रसायन के अलावा, इन सबके कारण, एक ओर चिज  निकलती जिसे प्राटिकुलेट प्रदार्थ कहते।",खतरनाक रसायन के अलावा इन सबके कारण एक और चीज निकलती जिसे प्राटिकुलेट पदार्थ कहते।,
इसका आकार 2.5 mm से कम होता और जब ये इंसान के फेफाड़ा में जाता तो उस इंसान कि आयु में कमी होती।,इसका आकार २.५ mm से कम होता और जब ये इसांन के फेफाड़ा में जाता तो उस इंसान की आयु में कमी होती।,
"इसके अलावा, वह कैंसर भी ला सकती।",इसके अलावा वह कैंसर भी ला सकती।,
"वायु प्रदू‌षण को विज्ञान के जगत में, AQI  नामक अंक से दिखाते हैं।",वायु प्रदू‌षण को विज्ञान के जगत में ए किउ आइ   नामक अंक से दिखाते हैं।,
"अगर किसी स्थान का  AQI 100 से ज्यादा होता, तो वहाँ के रह रहे लोगों को सांस लेने में बहुत मुश्किल हो सकती है।",अगर किसी स्थान का  ए किउ आइ १ ०  ०  से ज्यादा होता तो वहाँ के रह रहे लोगों को सांस लेने में बहुत मुश्किल हो सकती है।,
भारत के राजधानी दिल्ली में वायु प्रदूषण हमेशा प्रचलित रहता।,भारत की राजधानी दिल्ली में वायु प्रदूषण हमेशा बना रहता है ।,
"दिल्ली एक बहुत छोटा स्थान हैं, परंतु उसकी जनसंख्या बहुत ज्यादा हैं।",दिल्ली एक बहुत छोटा स्थान है परन्तु उसकी जनसंख्या बहुत ज्यादा है।,
"इसके कारण यहा के लोग बहुत सारे ऐसे गतिविधिया करते कि , वहाँ कि वायु बहुत प्रदूषित हैं।",इसके कारण यहां के लोग बहुत सारी ऐसी गतिविधियाँ करते हैं कि यहाँ की वायु बहुत प्रदूषित हो गई है।,
इन सब के अलावा अधोयोगिक स्थान भी बहुत सारे रसायनिक पदार्थ वायु में छोड़ देते जिसके कारण हवा प्रदूषित होती।,इन सब के अलावा औद्योगिक स्थान भी बहुत सारे रसायनिक पदार्थ वायु में छोड़ देते हैं जिसके कारण हवा प्रदूषित होती है ।,
इन सब के कारण न  केवल इंसान बल्की जानवर भी शिकार होते ।,इस सब के कारण न केवल इंसान बल्कि जानवर भी शिकार होते हैं ।,
"सभी लोगों में फेफड़ा कि शिकायत, सास लेने कि शिकायत कि हैं।",कई लोगों ने फेफड़ों तथा श्वसन संबंधी शिकायतें दर्ज की हैं।,
इन सब पर रोक लगाने के लिए सरकार ने बहुत सारे नियम बनाये हैं ।,इस सब पर रोक लगाने के लिए सरकार ने बहुत सारे नियम बनाये हैं ।,
जैसे कि सभी को अधिनिक वाहन का उपयोग करे जो कम प्रदूषण करती।,जैसे  कि सभी कोई  आधुनिक वाहन का उपयोग करे जो कम प्रदूषण करते हैं  ।,
बिजली पे चलने वाली गाड़ी का उपयोग के लिए लोगों को उत्साहित किया जाता।,बिजली पर चलने वाली गाड़ी का उपयोग के लिए लोगों को उत्साहित किया जाता।,
"बहुत सारी शिक्षा केंद्र जैसे IIT, ISFR इन सब पर अनुसंधान कर रहे ताकी इसे ठिक किया जा सके।","बहुत सारी शिक्षा केंद्र जैसे आइ आइ टि, आइ स फ र इन सब पर अनुसंधान कर रहे हैं ताकि इसे ठीक किया जा सके।",
जमीन प्रदूषण- अधोगिकरण  एंव बदलाव के कि कारण लोगे ने जितना हो सके उतना जमीन का दुरउपयोग किया।,जमीन प्रदूषण- औद्योगिकरण एवं बदलाव के कारण लोगों  ने जितना हो सके उतना जमीन का दुरुपयोग किया।,
"कोई भी इमारत बनाने के लिए, लोगे ने उस जमीन को खाली किया, उसके लिए वहा के पेड़, को काटा जिसके कारण, उस जमीन का प्रकृतिक अस्तितव खो गया।",कोई भी इमारत बनाने के लिए लोुगों ने उस जमीन को खाली किया उसके लिए वहां के पेड़ को काटा जिसके कारण उस जमीन का प्राकृतिक अस्तित्व खो गया।,
पैदावार के लिए लोग उसी खेत पे बार-बार उपयोग के कारण उसे बंजर बना देते।,पैदावार के लिए लोग उसी खेत पर बार-बार उपयोग के कारण उसे बंजर बना देते।,
यह एक प्रकार कि प्रदूषण हि है।,यह एक प्रकार का प्रदूषण ही है।,
"इसे भी ठिक करने के लिए सरकार बहुत सारे कठोर कदम लेते हैं, परन्तु आम नागरिक को उन सब चिज का अभाव न होने के कारण, कोई भी कदम आगे नहीं बड़ता।",इसे भी ठीक करने के लिए सरकार बहुत सारे कठोर कदम उठाती है  परन्तु आम नागरिक को उन सब चीज का अनुभव न होने के कारण कोई भी कदम आगे नहीं बढ़ता।,
"अगर, एक नजरिया से देखा जाय तो सभी प्रदूषण का कारण ये  इन्सान हि  हैं ।",अगर एक नजरिया से देखा जाय तो सभी प्रदूषण का कारण ये मनुष्य ही है।,
"सरकार कितना भी कानून बना ले अगर इन्सान अपने आप को न सुधारे, तो कुछ ‌नही हो सकता।",सरकार कितना भी कानून बना ले अगर इन्सान अपने आप को न सुधारे तो कुछ ‌नही हो सकता।,
आम लोग अपने गतिविधिया पे थोड़ा लगाम दें।,आम लोग अपनी गतिविधियों पर थोड़ा लगाम दें। यह पृथ्वी एक ही है।,
यह पृथ्वी एक हि हैं।,यह पृथ्वी एक ही है।,
अगर इसे अभी खराब कर देगे तो हमारे आने वाले भविष्य के लिए कुछ भी नहीं रहेगा।,अगर इसे अभी खराब कर देंगे तो हमारे आने  वाले भविष्य के लिए कुछ भी नहीं रहेगा।,
आज कल पूरी दुनिया सस्टेनेबल शब्द का उपयोग कर रहे हैं।,आज कल पूरी दुनिया सस्टेनेबल शब्द का उपयोग कर रही है।,
हम सभी के समान को ऐसे उपयोग कारण  चाहिए ताकी वो भविष्य को सुरक्षित रखे।,हम सभी को ऐसी वस्तुओं का उपयोग करना चाहिए ताकि वो भविष्य को सुरक्षित रखे।,
इतिहास में बहुत सारि  कहानियां का प्रमाण मिलता है और वह भी अलग-अलग तथ्यों से।,इतिहास में बहुत सारी कहानियोंं का प्रमाण मिलता है और वह भी अलग-अलग तथ्यों से।,
रामायण जो रामचरितमानस के वालमिकी द्वारा लि गई है उसमें प्रभु श्रीराम के चरित्र  और जीवन पर लिखा गया  है,रामायण जो वाल्मीकि द्वारा लिखी गई है उसमें प्रभु श्रीराम के चरित्र  और जीवन पर लिखा गया  है।,
"इस कहानी में राम, सिता, हनुमान, लक्ष्मण मंथरा , कैकयी आदि है।","इस कहानी में राम, सीता, हनुमान, लक्ष्मण मंथरा , कैकेयी आदि हैं।",
प्रभु श्री राम का जन्म अयोध्या में हुआ ऐसा सभी मानना है और इतिहास इसको साक्षी भी मानती है।,प्रभु श्री राम का जन्म अयोध्या में हुआ ऐसा सभी का मानना है और इतिहास भी साक्ष्य है इस बात का ।,
"दशरथ के चार पुत्र हुए राम, लक्ष्मण, भरत, श्रत्रुघन।","दशरथ के चार पुत्र हुए राम, लक्ष्मण, भरत, श्रत्रुघन।",
चारो पुत्रो को आश्रम भेज दिया गया। ,चारों पुत्रों को आश्रम भेज दिया गया।,
वही चारो की शादि यानि विवाह भी हुआ।,वहीं चारों  की शादी यानि विवाह भी हुआ।,
जब यह बात अयोध्या पहुं‌ची की चारो पुत्र वापस आ रहे तो कोशल्या को बहुत बुरा लगा वह कैकेयी से बोली की मेरे पुत्र को राजा बनाने का अवसर कभी नही मिलेगा। और वह फुट फुट के रोने लगी पुत्र मोह में।,जब यह बात अयोध्या पहुं‌ची कि चारो पुत्र वापस आ रहे हैं तो कैकेयी को बहुत बुरा लगा वह कौशल्या से बोली कि मेरे पुत्र को राजा बनाने का अवसर कभी नही मिलेगा और वह पुत्र मोह में फूट-फूट कर रोने लगी ।,
मन्थरा तब चुप चाप सुन रही थी और तब तक उसने यह जो वह सोच रही थी उसने कैकेयी को बोल दिया।,मन्थरा तब चुप-चाप सुन रही थी और तब तक उसने यह जो वह सोच रही थी उसने कैकेयी को बोल दिया।,
