Input sentence,Output sentence,
क्योंकि मेरी और मेरे भाई का पत्र एक ही विषय पर था तो मैं उसके लिखे पत्र पर उसका नाम काट कर अपना नाम लिखकर मां को दिखाया कि मेरे अपना पत्र लिख लिया है।,क्योंकि मेरे और मेरे भाई के पत्र का विषय एक ही  था इसलिए मैंने उसके लिखे हुए पत्र पर उसका नाम काटकर अपना नाम लिखकर मां को दिखाया कि मैंने अपना पत्र लिख लिया है।,
पर जब मां ने देखा कि मैं भी वही गलत किया था जो मेरे भाई ने गलत किया था। तब माॅ को सक हुआ और उन्होंने मुझे बहुत मारा और 10 बार पत्र लिखवाया,पर जब मां ने देखा कि मैंने भी वही गलती की जो मेरे भाई ने की थी तब माँ को शक हुआ और उन्होंने मुझे बहुत मारा और १० बार पत्र लिखवाया।,
 उस दिन से आज दिन तक मैंने अपना काम खुद से करने को ही सही माना है।,उस दिन से आज तक मैं अपना काम स्वयं करना ही श्रेयस्कर मानता हूँ।,
और इस हादसा एक यादगार आशा बन गया।,और यह हादसा एक यादगार अनुभव बन गया।,
उ और जैसा हम सब जानते हैं कि सारी यादें अच्छी नहीं होती कई बुरी यादें भी हमें बहुत कुछ सिखा देती हैं।,"और जैसा कि हम सब जानते हैं, सारी आदतें अच्छी नहीं होतीं — कई बुरी आदतें भी हमें कुछ अच्छा सिखा जाती है।",
कॉलेज का मेरा पहला दिन मेरे उन दिनों मे एक हैं। जब  मैं बहुत उदास हुआ।,"कॉलेज का मेरा पहला दिन मेरे उन दिनों में से एक है, जब मैं बहुत उदास हुआ था।",
और उसमे भी मेरा भाई मैं और मेरा जुड़वा भाई बचपन से ही साथ पड़े हुए हैं।,और उसमें भी मैं और मेरा जुड़वां भाई बचपन से ही साथ पढ़े हुए हैं।,
हम जहां भी जाते थे साथी जाते थे।,हम जहां भी जाते थे साथ ही जाते थे।,
हम जब परीक्षा की पढ़ाई करने के 1 साल घर से दूर रहे तब भी मेरा भाई मेरे साथ ही था।,जब हम परीक्षा की पढ़ाई करने के लिए एक साल घर से दूर रहे तब भी मेरा भाई मेरे साथ ही था।,
और कॉलेज का पहला दिन या जब मुझे बहुत अकेला लगा रहा था।,वह कॉलेज का पहला दिन था जब मुझे बहुत अकेला लग रहा था ।,
उसे दिन मुझे मेरे पिता की कानपुर तक छोड़ने आए थे।,उस दिन मुझे मेरे पिताजी कानपुर तक छोड़ने आये थे।,
हमारी रेलगाड़ी यात्रा रात 3:00 बजे आई जिसके कारण मैं रात में अच्छे से सोया भी नहीं था।,हमारी रेलगाड़ी रात्रि ३:०० बजे आयी जिसके कारण मैं रात में अच्छे से सोया भी नहीं था।,
उसे दिन यहाॅ बारिश का मौसम था ,उसी दिन यहाँ बारिश का मौसम था। ,
उस दिन मेरे पिताजी मेरे साथ रुखने वाले थे।,उस दिन मेरे पिताजी मेरे साथ रुकने वाले थे।,
पर उसे अगले दिन ही एक बहुत जरूरी काम आ गया जिस कारण उन्हें मुझे उसी दिन ही छोड़ कर जाना पड़ा।,पर उसके अगले दिन ही एक बहुत जरूरी काम आ गया जिसके कारण उन्हें मुझे उसी दिन ही छोड़ कर जाना पड़ा।,
उस दिन मुझे समझ नहीं आ रहा थ कि मै क्या करना चाहिए।,उस दिन मुझे यह समझ नहीं आ रहा था कि मुझे क्या करना चाहिए।,
पूरा दिन में बस अपने बिस्तर पर लेटा रहा था,पूरा दिन मैं बस बिस्तर पर लेटा रहा था।,
आज के इस समय में मनुष्य इतना स्वाथी हो गया। है कि वह अपने अलावा किसी और की सोचता भी नहीं है।,आज के इस समय में मनुष्य इतना स्वार्थी हो गया है कि वह अपने अलावा किसी और के बारे में सोचता भी नहीं है।,
और उसके बाद पर्यावरण के बारे में सोचना का तो समय ही नहीं है।,और उसके बाद पर्यावरण के बारे में सोचने का तो समय ही नहीं है।,
परंतु जिस प्रकार हम और पर्यावरण जुड़े हैं हमें पर्यावरण की ओर सोचना चाहिए ,परन्तु जिस प्रकार हम और पर्यावरण एक दूसरे से जुड़े हैं ठीक उसी प्रकार हमें भी पर्यावरण के बारे में सोचना चाहिए ।,
हमें हमारे जीवन की सभी वस्तुएं अपने आसपास के पर्यावरण से ही प्राप्त होती है।,हमें हमारे जीवन की सभी वस्तुएं अपने आसपास के पर्यावरण से ही प्राप्त होती हैं।,
जिसे हम बिना कुछ सोचे समझे गनदा किये जा रहे हैं।,जिसे हम बिना कुछ सोचे समझे गन्दा किये जा रहे हैं।,
हमें यह ध्यान  मे रखना चाहिए कि पर्यावरण को हानि करने से हमारी ही हानी होगी ,हमें यह ध्यान में रखना चाहिए कि पर्यावरण को हानि पहुँचाने से हमारी ही हानि होगी।,
सरकार भी पर्यावरण को साफ करने के लिए बहुत सारे अलग-अलग कदम इठा रही है।,सरकार भी पर्यावरण को साफ-सूथरा बनाये रखने के लिए बहुत सारे अलग-अलग कदम उठा रही है।,
इसीलिए हमें अपने पर्यावरण का ख्याल अपने परिवार की तरह ही रखना चाहिए।,इसीलिए हमें अपने पर्यावरण की देखभाल अपने परिवार की तरह ही करनी चाहिए।,
उस दिन मैं पहली बार घर से दूर एक नए शसर में रहने आई थी।,उस दिन मैं पहली बार घर से दूर एक नए शहर में रहने आई थी।,
"मेरा कॉलेज डॉ० अंबेदकर इंस्टीट्यूट, कानपुर शहर में स्थित है।","मेरा कॉलेज डॉ० अम्बेडकर इंस्टीट्यूट, कानपुर शहर में स्थित है।",
कॉलेज में घुसने के साथ ही हमने खूब हरियाली देखी।,कॉलेज में प्रवेश करते ही हमने चारों ओर हरियाली ही  हरियाली देखी।,
अंदर घुसते ही कॉलेज की मेन इमारत थी। जिसमें सारे सरकारी कर्मचारियों के दफ्तर थे।,"अंदर घुसते ही कॉलेज की मुख्य इमारत दिखी, जिसमें सभी कर्मचारियों के दफ़्तर थे।",
मेन इमारत से जब हम थोड़ा आगे बड़े तो हमें हमारी कक्षाओं की इमारत मिली।,मुख्य इमारत से जब हम थोड़ा आगे बढ़ें तो हमें हमारी कक्षाओं की इमारतें मिली।,
हम चार सहेलिया जल्दी से कक्षा में घुस गए।,हम चार सहेलियाँ जल्दी से कक्षा में घुस गईं ।,
क्योंकि ये उस विषय की हमारी पहली कक्षा थी तो अध्यापक ने ज्यादा कुछ पढ़ाया नहीं और सबको आपस में एक दूसरे का परिचय देने को कहा।,क्योंकि ये उस विषय की हमारी पहली कक्षा थी इसलिए अध्यापक ने ज्यादा कुछ पढ़ाया नहीं और सबको आपस में एक-दूसरे का परिचय देने को कहा।,
कक्षा समाप्त होने के बाद हम सारे दोपहर का खाना खाने के लिए वापिस अपने होटल गए।,कक्षा समाप्त होने के बाद हम सभी दोपहर का खाना खाने के लिए वापस अपने होटल गए।,
वहां पहुंच के जल्दी से अपना खाना खत्म कर के हम वापस से अपनी बची हुई कक्षाओं के लिए गए।,वहाँ पहुँच कर जल्दी से अपना खाना खत्म करके हम वापस अपनी बची हुई कक्षाओं के लिए गए।,
सबने अपनी पसंद के कई खेल खेले ,सबने अपनी पसंद के कई खेल खेले।,
कुछ ने बैडमिंटन खेला तो कुछ ने टेबल टेनिस तो कुछ ने क्रिकेट।,"कुछ ने बैडमिंटन खेला, टेबल टेनिस खेला, तो कुछ ने क्रिकेट।",
खेलकूद के फिर थक कर हम वापस अपने कमरों में आराम करने के लिए पहुंचे ताकि अगले दिन फिर से नए उत्साह के साथ कॉलेज जा सके।,खेलकूद से फिर थक कर हम वापस अपने कमरों में आराम करने के लिए पहुंचे ताकि अगले दिन फिर से नए उत्साह के साथ कॉलेज जा सके।,
हम मनुष्य वह प्राणी है जो जीवित रहने के लिए अपने पर्यावरण पर निर्भर करते हैं।,"मनुष्य वह प्राणी है, जो जीवित रहने के लिए अपने पर्यावरण पर निर्भर रहता है।",
"मनुष्य जीव जंतु और पेड़ पौधे आपस में एक संतुलन बनाए रखते हैं, स्वच्छ और वातावरण बनाए रखने के लिए।","मनुष्य, जीव-जंतु तथा पेड़-पौधे स्वच्छ वातावरण बनाए रखने के लिए आपस में एक संतुलन बनाए रखते हैं ।",
लेकिन आजकल मनुष्य के लालच के वजह से हम इस अच्छे वातावरण को दूषित कर रहे हैं।,लेकिन आजकल मनुष्य लालच की वजह से इस अच्छे वातावरण को दूषित कर रहा है।,
"इंसान अपनी वस्तुओं की लालच में आदा से ज्यादा पेड़ों और पशुओं को नुकसान पहुंचा रहा है, जिसकी वजह से वह अपना पर्यावरण भी प्रदूषित करता है।",मनुष्य अपनी स्वार्थपूर्ति के लालच में वृक्षों तथा पशुओं को नुकसान पहुंचा रहा है जिसकी वजह से वह अपना पर्यावरण भी दूषित कर रहा है।,
एक संतुलन बनाए रखने के लिए मनुष्य को अपनी लालच कम करनी होगी ताकि वह अपने आसपास की वस्तुओं का विनाश करने के बजाय उनका सदुपयोग कर सके।,संतुलन बनाए रखने के लिए मनुष्य को अपनी इच्छाओं एवं आवश्यकताओं में कमी लानी होगी ताकि वह अपने आसपास की वस्तुओं का विनाश करने के बजाय उनका सदुपयोग कर सके।,
हम अपने रोज मर्दा की जिंदगी के लिए अपने आसपास मौजूद पर्यावरण पर निर्भर करते हैं।,हम अपनी रोज़मर्रा की ज़िंदगी के लिए अपने आसपास मौजूद पर्यावरण पर निर्भर करते हैं।,
इसलिए हमें समझदारी और होशियारी से काम लेना चाहिए और कोशिश करनी चाहिए कि हम अपने आसपास के पर्यावरण को सुरक्षित रखने की कोशिश करें।,इसलिए हमें समझदारी और होशियारी से काम लेना चाहिए और कोशिश करनी चाहिए कि हम अपने आसपास के पर्यावरण को सुरक्षित रखें।,
अगर हम एक संतुलन बनाकर रखे तो हम अपने आसपास एक अच्छा वातावरण बनाए रख सकते हैं।,अगर हम एक संतुलन बनाकर रखेगें  तो हम अपने आसपास एक अच्छा वातावरण बनाए रख सकते हैं।,
और कोशिश कर सकते हैं कि हमारे आगे आने वाले पुश्ते भी इस्का लुफ्त उठा सके।,और कोशिश कर सकते हैं कि हमारी आने वाली पीढ़ियाँ  भी इसका लाभ उठा सकें।,
इन सब चीजों से बचने का सबसे सरल इलाज है सबको शिक्षा उपलब्ध कराना कई गांवों और शहरों में माध्यमिक शिक्षा मुफ्त और जरूरी भी कराई गई है।,इन सब चीजों से बचने का सबसे सरल उपाय है सबको शिक्षा उपलब्ध कराना। कई गांवों और शहरों में माध्यमिक शिक्षा मुफ्त और अनिवार्य भी कराई गई है।,
एक परिवार में महिला की शिक्षा को ज्यादा महत्व दिया जाता है क्योंकि ऐसा कहा जाता है कि हीरा अगर कोई महिला शिक्षित है तो वह अपने बच्चों को भी सही से पढ़कर उन्हें भी शिक्षित करेगी।,एक परिवार में महिला की शिक्षा को ज्यादा महत्व दिया जाता है क्योंकि ऐसा कहा जाता है कि अगर कोई महिला शिक्षित है तो वह अपने बच्चों को सही दिशा और संस्कार देने का प्रयास करेगी।,
एक शिक्षित आदमी समाज में अच्छी तरह से अपना जीवन व्यतीत कर सकता।,एक शिक्षित आदमी समाज में अच्छी तरह से अपना जीवन व्यतीत कर सकता है।,
हमारा दुर्भाग्य ऐसा था कि 12वीं की परीक्षा खत्म होते ही कोविद-19 नामक महाप्रलय ने आक्रमण कर दिया।,हमारा दुर्भाग्य ऐसा था कि १२ वीं की परीक्षा खत्म होते ही 'कोविड-१९' नामक महाप्रलय ने आक्रमण कर दिया।,
हम सब कि कॉलेज देखने इच्छा भी घूमिल सी हो गई थी।,हम सबकी कॉलेज देखने की इच्छा भी धूमिल सी हो गई थी।,
तभी एक दिन 8 फरवरी 2022 को कॉलेज खोलने का नोटिस निकाल ,"तभी एक दिन, ८ फरवरी २०२२ को कॉलेज खुलने का नोटिस आया।",
हम सब फुले न समाय,हम सब फूले नहीं समाए।,
 मेरे कॉलेज का पहला दिन 17 फरवरी 2022 के दिन मेरे जीवन का सबसे यादगार दिन हैं।,मेरे कॉलेज का पहला दिन १७ फरवरी २०२२ मेरे जीवन का सबसे यादगार दिन है।,
"मैं एक गांव से पढ़ी-लिखी लड़की, दिल्ली जैसे बड़े शहर में अकेले पढ़ने आई ","मैं एक गांव की पढ़ी-लिखी लड़की, दिल्ली जैसे बड़े शहर में अकेले पढ़ने आई।",
कॉलेज जाने की इतनी उत्सुकता थी। की अपना सामान अपने दोस्तों के कमरे पर रखकर बिना अपना रहने के ठिकाना ढूंढे कॉलेज की ओर चल पड़ी।,कॉलेज जाने की इतनी उत्सुकता थी कि अपना सामान अपने दोस्तों के कमरे पर रखकर अपने रहने का ठिकाना ढूंढ़े बिना कॉलेज की ओर चल पड़ी।,
"आज भी वो मेरे आखों के सामने आता है, दोस्त के कमरे पर अपना सामान रख कर में रिक्शा लेकर कॉलेज की ओर निकल पड़ी।","आज भी वो मेरी आखों के सामने आता है, दोस्त के कमरे पर अपना सामान रखकर मैं रिक्शा लेकर कॉलेज की ओर निकल पड़ी।",
पहली बार हिंदू कॉलेज के प्राणन में कदम रखा।,पहली बार हिंदू कॉलेज के प्रांगण में कदम रखा।,
"इतनी भीड़ थी इतने सारे लोग उन अनजान शहरों में कुछ जाने पहचाने चेहरे भी दिखे, मेरे वर्ग साथी जिनसे अब तक बस ऑनलाइन ही बातचीत हुई थी।","इतनी भीड़-भाड़ वाली जगह इतने सारे लोग उस अनजान शहर में मुझे कुछ जाने-पहचाने चेहरे भी दिखे, जिनसे अब तक बस ऑनलाइन ही बातचीत हुआ करती थी।",
बहुत हंसी आती उस दिन को याद कर एक तरफ बहुत खुश थी लोगों से मिलकर दूसरी तरफ ज्यादा बातचीत भी नहीं कर पा रही थी।,"बहुत हंसी आती है उस दिन को याद करके, मैं बहुत खुश थी लोगों से मिलकर किन्तु उनसे ज़्यादा बातचीत भी नहीं हो पा रही थी।",
सभी दोस्तों से मिलने के बाद हम सभी अपने शिक्षकों से भी मिलने गए सारे शिक्षक एवं छात्रगण बड़े से खेल के मैदान में खड़े थे।,सभी दोस्तों से मिलने के बाद हम सभी अपने शिक्षकों से भी मिलने गए। सारे शिक्षक एवं छात्रगण बड़े से खेल के मैदान में खड़े थे।,
कई पत्रकार भी आए थे बहुत लोगों का साक्षात्कार भी कर रहे थे।,"कई पत्रकार भी आए थे, जो बहुत लोगों का साक्षात्कार भी कर रहे थे।",
